IPC主分类,发明名称,摘要
G06Q10/063  ,一种铝电解工业碳排放核算方法及相关设备 [发明],本发明公开了一种铝电解工业碳排放核算方法及相关设备，属于电解工业碳排放领域，本铝电解工业碳排放核算方法根据铝电解工业的全生命周期明确了铝电解碳排放核算边界，并分别计算铝电解过程中各个阶段的碳排放量，最终通过铝电解过程中各个阶段的碳排放量核算出铝电解碳排放总量；本发明确立了按照铝电解不同生产过程中的碳排放分别核算、加和求总的核算方法，为铝电解工业提供碳排放核算方法，为碳减排路径的选择提供有力支撑。
G16C20/20  ,一种计算SiNx原子浓度的方法 [发明],本发明提供了一种计算SiN＆lt;subgt;x＆lt;/subgt;原子浓度的方法，通过光学测试获得其在带间跃迁段的光学常数，并通过特定的物理规律进一步分析计算这些光学常数，从而获得SiN＆lt;subgt;x＆lt;/subgt;薄膜的原子浓度及配位数。该计算SiN＆lt;subgt;x＆lt;/subgt;原子浓度的方法可以表征不同条件制备的多层SiN＆lt;subgt;x＆lt;/subgt;薄膜的原子浓度及配位数，从而获得适合器件需要的SiN＆lt;subgt;x＆lt;/subgt;薄膜。对于进一步利用SiN＆lt;subgt;x＆lt;/subgt;薄膜制备各种器件，包括在硅基太阳电池上应用，具有突出的意义。
G01N35/02  ,污染物与CO2协同吸收材料高通量设计系统、装置及方法 [发明],本发明公开了污染物与CO＆lt;subgt;2＆lt;/subgt;协同吸收材料高通量设计系统、装置及方法，涉及智能制造装备产业领域，包括吸收剂全自动高通量制备模块、吸收剂全自动动力学/热力学实验模块、气/液相表征模块、计算机集成控制系统，主要装置包括高精度六维中控机械臂、取料转运装置、加热搅拌制液装置、基础参数表征装置、吸收性能测试装置、解吸性能测试装置、稳定性能测试装置、废液收集装置。本发明通过数据驱动机器人科学家高通量合成吸收剂方法，实现材料理性设计和快速开发，可减小人力成本，提高实验效率，大大缩短吸收材料研发周期。
G16C60/00  ,基于响应面法优化马氏体时效钢复合材料热处理参数的方法 [发明],本发明公开了一种基于响应面法优化马氏体时效钢复合材料热处理参数的方法，属于增材制造后处理领域，本发明通过单因素实验确定了影响屈服强度和洛氏硬度的因素及水平，基于响应面法对固溶温度、固溶时间和时效温度几个热处理参数进行优化，从而获得最佳热处理参数组合；本发明提供了实验参数与响应值之间的明确函数表达式及直观三维响应面以及等高线图，具有实验次数少、精确度高、预测性能好等优点，可以以较低成本更加高效的方法快速找出热处理参数最优值，大大降低了热处理参数寻优难度。
B60T8/17  ,一种制动大蠕滑工况下轮轨黏着控制方法及装置 [发明],本发明涉及一种制动大蠕滑工况下轮轨黏着控制方法及装置；方法包括：获取车辆参数、材料特性参数、初始轮轨温度参数和初始水膜厚度参数；考虑温度和材料特性参数的相互耦合关系，采用ZMC模型计算轮轨固体材料承担压力，采用简化的N‑S方程计算轮轨间流体介质材料承担压力；计算轮轨固体材料承担压力和轮轨间流体介质材料承担压力之和，并将压力之和与列车轴重进行比较，得到比较结果；将轮轨接触界面摩擦系数输入至FASTSIM轮轨切向力计算模型中，得到轮轨黏着系数；计算列车制动减速度。本发明通过双层迭代计算反映制动过程中温度和材料特性参数的动态变化过程，实现轮轨黏着系数的快速与精确计算，能够实现黏着制动下对列车的防滑控制。
G16C20/50  ,一种基于分子空间搜索的虚拟筛选方法 [发明],本发明属于分子虚拟筛选领域，具体公开了一种基于分子空间搜索的虚拟筛选方法，包括依次进行的以下步骤：S1、对待筛选配体分子集和受体口袋信息进行预处理；S2、计算配体分子集中的所有小分子在分子空间中的表示向量；S3、根据分子表示算法设计分子空间中样本相似度算法；S4、采用启发式算法在配体分子集的分子空间中利用已构建的数据结构进行搜索，启发式算法以分子对接算法或虚拟筛选打分算法作为目标函数；S5、根据搜索结果，对已搜索的小分子进行排序，筛选出的最优配体分子子集。本发明能够对大规模或超大规模分子集进行快速、准确搜索，提高了虚拟筛选的效率与规模。本发明适用于分子的虚拟筛选。
G06F9/50  ,确定VASP软件并行参数的方法、装置、计算设备及存储介质 [发明],本发明公开了一种确定VASP软件并行参数的方法、装置、计算设备及存储介质，方法包括：确定VASP软件的目标算例信息，目标算例信息包含目标算例的目标布里渊区K点数；获取集群的节点硬件配置信息；根据目标算例信息和节点硬件配置信息，确定VASP软件的并行运行总核数和申请的总节点数；如果目标布里渊区K点数小于等于第一阈值，基于目标布里渊区K点数与并行运行总核数的最大公约数来确定第一参数值；如果目标布里渊区K点数大于第一阈值，基于目标布里渊区K点数与并行运行总核数的较小公约数来确定第一参数值；基于并行运行总核数和第一参数值，来确定第二参数值和第三参数值。根据本发明的技术方案，能实现在充分利用集群硬件资源的情况下，提高VASP软件的计算效率。
G01N21/31  ,一种新型的流池法溶出度检测方法 [发明],本申请涉及溶出度检测技术领域，公开了一种新型的流池法溶出度检测方法，包括：S1、样品制备：将要检测的药物固体制剂按照一定比例溶解在适当的溶剂中，制备成一定浓度的样品溶液；S2、流动注射系统设置：根据实验需求，配置流动注射系统的参数，确保系统正常运行并达到稳定状态；S3、建立标准曲线：使用已知浓度的药物标准溶液，通过流动注射系统进行连续注射，并利用荧光或紫外‑可见吸收检测器监测药物浓度的变化，根据药物浓度与检测信号的关系建立标准曲线。通过流迟法溶出度检测的结果数据，构建相应的数学模拟模型，通过实验数据的累积对模型进行验证和调优，从而方便预测药物溶出度在不同条件下的变化趋势。
G16C20/70  ,一种预测有机化学品在不同土壤中吸附能力的方法 [发明],本发明公开了一种预测有机化学品在不同土壤中吸附能力的方法，包括获取有机化学品吸附数据；对所述有机化学品吸附数据进行分类和预处理；筛选合适的模型输入参数；根据分类后的所述有机化学品吸附数据和所述模型输入参数，训练机器学习模型；使用所述机器学习模型对新数据进行预测，评估有机化学品在土壤中的吸附能力。本发明能够实现对有机化学品的土壤吸附能力准确评估，为有机化学品的污染防治提供科学依据。
B01D53/68  ,基于智能化铜冶炼烟气制酸净化固氟系统用智能处理方法 [发明],本发明公开了基于智能化铜冶炼烟气制酸净化固氟系统用智能处理方法，包括如下步骤：S1、采集铜精矿入炉炉料中的氟含量及抛料量，通过计算模型计算出带入制酸净化中氟的总量；S2、制酸固氟智能加药系统根据氟的总量，得到应加入固氟药剂的量。本发明通过计算模型和每日理论水玻璃添加量的计算方式，首先能够对进入入炉炉料的抛料量进行采集，从而根据采集的数据能够计算出每日进入净化系统的氟含量和固氟药剂加入量，并利用智能化工业互联网平台，对当时风机出口监测的氟指标进行对比分析，判断水玻璃添加量是否合理，并根据判断结构对固氟药剂的投加量进行调整，从而能够通过适宜的水玻璃添加量，保证氟化物完全去除，提高除氟的效果。
G16C60/00  ,一种既有混凝土基体修复界面过渡区靶向调控方法及系统 [发明],本发明属于混凝土修复领域，提供了既有混凝土基体修复界面过渡区靶向调控方法及系统。其中，既有混凝土基体修复界面过渡区靶向调控方法包括计算出修复界面不同距离处每个分隔区间的微观力学性能均值及每个分隔区间的物相含量均值；将修复界面不同距离处的每个分隔区间的微观力学性能均值与各个物相含量均值进行拟合，确定出影响微观力学性能值最大的物相类别；根据微观力学性能值与影响其最大的物相的拟合关系，确定出设定微观力学性能值要求所对应的影响微观力学性能值最大的物相含量和分布，进而得到相匹配的修复材料的组份和配比调控方案。其能够提高对既有混凝土基体修复界面靶向调控的精准性。
G16C60/00  ,一种基于压痕检测的材质劣化评估方法 [发明],一种基于压痕检测的材质劣化评估方法，包括以下步骤：1)建立材质劣化数据库，材质劣化数据库用于对材料的劣化类别数据和劣化程度数据进行收集。本发明建立了基于压痕检测的材质劣化评估方法，实现了仅依靠无损检测数据评估材质劣化程度，可用于在役设备管道劣化程度现场评估，进而判断其适用性，效率提高、成本降低；同时本方法适用多种与力学性能变化相关的材质劣化类型评估，且能够根据输入信息自动判别材质劣化类型，明确检验参数；该技术可有效积累材质劣化信息数据，通过数据不断积累和模型再训练机制，持续的改进和优化评估模型，利用本技术进行材质劣化程度评估，其结果可信度会越来高。
H02J3/24  ,一种风光氢储系统运行优化控制方法 [发明],本发明公开了一种风光氢储系统运行优化控制方法，包括：在风光氢储系统数学模型的基础上建立平抑风光波动模型，得到平抑风光波动模型的输出功率；将平抑风光波动模型的输出功率输入由碱性电解水制氢与质子交换膜电解水制氢耦合运行的电解槽中，优化电解槽耦合运行策略；分别建立以风光消纳总功率最大和风光氢储系统总运行成本最小为目标函数的双层优化模型；采用改进的鹈鹕优化算法对双层优化模型进行求解，得出风光氢储系统的总风光消纳功率以及运行成本。本发明提高了风光氢储系统的制氢效率，实现了风光氢储系统的运行优化，大大节省了经济成本，保证了系统的稳定性。
G16C20/10  ,一种城市局地光化学反应的O3量化方法 [发明],本发明公开了一种城市局地光化学反应的O＆lt;subgt;3＆lt;/subgt;量化方法，包括：基于三维空气质量溯源模式提取本地源排放贡献的NO＆lt;subgt;2＆lt;/subgt;浓度L_NO＆lt;subgt;2＆lt;/subgt;与O＆lt;subgt;3＆lt;/subgt;浓度L_O＆lt;subgt;3＆lt;/subgt;，周边区域源排放贡献的NO＆lt;subgt;2＆lt;/subgt;浓度S_NO＆lt;subgt;2＆lt;/subgt;与O＆lt;subgt;3＆lt;/subgt;浓度S_O＆lt;subgt;3＆lt;/subgt;以及边界背景贡献的NO＆lt;subgt;2＆lt;/subgt;浓度B_NO＆lt;subgt;2＆lt;/subgt;与O＆lt;subgt;3＆lt;/subgt;浓度B_O＆lt;subgt;3＆lt;/subgt;；基于L_NO＆lt;subgt;2＆lt;/subgt;与L_O＆lt;subgt;3＆lt;/subgt;，计算NO＆lt;subgt;2＆lt;/subgt;的臭氧生成潜势OP＆lt;subgt;N＆lt;/subgt;；结合OP＆lt;subgt;N＆lt;/subgt;及NO＆lt;subgt;2＆lt;/subgt;观测浓度，计算城市局地反应贡献的O＆lt;subgt;3＆lt;/subgt;浓度Chem_O＆lt;subgt;3＆lt;/subgt;；基于S_NO＆lt;subgt;2＆lt;/subgt;、B_NO＆lt;subgt;2＆lt;/subgt;、OP＆lt;subgt;N＆lt;/subgt;、S_O＆lt;subgt;3＆lt;/subgt;与B_O＆lt;subgt;3＆lt;/subgt;，得到周边与边界向目标城市直接输送的O＆lt;subgt;3＆lt;/subgt;贡献TS_O＆lt;subgt;3＆lt;/subgt;和TB_O＆lt;subgt;3＆lt;/subgt;。本发明可量化城市内基于局地光化学反应的O＆lt;subgt;3＆lt;/subgt;生成量，为城市O＆lt;subgt;3＆lt;/subgt;污染防治提供参考和依据。
G16C60/00  ,一种激光原位成型碳纤维复合材料构件残余应力分布计算方法 [发明],本发明公开了一种激光原位成型碳纤维复合材料构件残余应力分布计算方法，该方法将移动激光热源、动态铺放压力和材料激活相结合，通过仿真碳纤维复合材料激光原位成型过程来获得构件中温度场分布及演变过程，从而获得构件内部的残余应力分布。该方法具有计算周期短，成本低，残余应力分布预测准确等特点，为激光原位成型碳纤维复合材料构件提供依据。
G16C20/10  ,一种曲流河点坝泥质夹层的建模方法及装置 [发明],本发明涉及一种曲流河点坝泥质夹层的建模方法及装置，所述方法包括：获取曲流河的地质参数，生成包含多个控制点的河道矢量中线，计算每个控制点的曲率；根据河道矢量中线和地质参数对曲流河的河道和泥质夹层进行模拟，得到曲流河网格模型；利用预设的椭球体移除算法对泥质夹层进行剥蚀，得到曲流河点坝泥质夹层河道模型。本发明对曲流河的夹层进行刻画，能更真实地展示曲流河的地貌特征，利用预设的椭球体移除算法对泥质夹层被侵蚀的过程进行模拟，能够更客观、更准确地对曲流河夹层进行模拟，为曲流河的研究提供了可靠的理论工具。
G16C20/20  ,基于AE-BiRNN网络的高光谱片烟沁润度检测及评价方法 [发明],本发明公开了一种基于AE‑BiRNN网络的高光谱片烟沁润度检测及评价方法，包括：1，使用烘箱法计算片烟的不同含水率，获取不同含水率下的片烟高光谱图像集合；2，使用OTSU分割片烟高光谱图像背景，构建高光谱片烟含水率数据集；3，建立AE‑BiRNN片烟含水率预测模型；4，实现片烟水分分布可视化，并提出“沁润度”概念对片烟水分均匀性进行评价。本发明能减少高光谱分析中对预处理的依赖性，从而实现片烟含水率预测、水分分布可视化及沁润度评价。
C21B5/00  ,一种高炉高富氧喷煤方法 [发明],本发明涉及冶金工程技术领域，公开了一种高炉高富氧喷煤方法，包括S1、在高炉顶部设置富氧供应系统，将高纯度的氧气注入到高炉内，以增加燃烧氧浓度；S2、采用多点喷吹方式，将煤粉均匀地喷入高炉炉缸中；S3、通过调节富氧供应量、煤粉喷吹速度和角度参数，控制煤粉的燃烧状态和高炉内的温度分布；S4、在高炉内设置煤气回收装置，回收燃烧后的煤气并进行能量回收。通过富氧供应、多点喷吹、实时监测和智能控制等手段，优化了煤粉燃烧过程，提高了冶炼效率并降低了能耗。它能够实现煤粉的充分燃烧，提高高炉内的温度分布和稳定性，并通过煤气回收和能量利用等措施，提高能源利用效率。
G16C60/00  ,基于修复材料-既有结构协同服役寿命预测方法及系统 [发明],本发明属于混凝土修复领域，提供了一种基于修复材料‑既有结构协同服役寿命预测方法及系统。其中，基于修复材料‑既有结构协同服役寿命预测方法，包括获取当前修复体系的修复界面剪切粘结性能测试数据、环境作用下修复材料自由变形测试数据以及修复界面剪切疲劳性能测试数据，计算修复材料‑既有结构协同服役寿命预测年限，并根据预测年限与服役期设计年限的比较结果，判断当前修复体系是否能够在服役期设计年限内安全协同服役。其解决了环境作用下修复材料与既有结构协同服役性能评价的问题，利用环境作用对界面产生疲劳损伤特性，与界面疲劳实验结合，能够在较短实验周期内实现修复材料‑既有结构协同服役寿命的预测。
G06F30/20  ,一种非线性橡胶隔振器静动态特性计算方法 [发明],本发明公开了一种非线性橡胶隔振器静动态特性计算方法，包括如下步骤：S1：Yeoh三阶模型作为隔振器橡胶材料的超弹性本构模型；S2：确定Yeoh模型中的材料参数C＆lt;subgt;ij＆lt;/subgt;；S3：构建橡胶隔振器的物理模型，物理模型的橡胶部为S2所确定材料参数C＆lt;subgt;ij＆lt;/subgt;的Yeoh模型；S4：对S3所构建的橡胶隔振器的模型分析橡胶隔振器的静态变形；S5:对S3所构建的橡胶隔振器的模型动态分析输出橡胶隔振器的垂向固有频率。本发明中，所提出的非线性橡胶隔振器静动态特性计算方法，能够有效计算强非线性大变形橡胶隔振器动静态特性，计算精度高可有效用于大变形低频橡胶隔振器的设计。
G16C20/10  ,一种含硫气田站场金属管材内腐蚀失效脆弱性评价方法 [发明],一种含硫气田站场金属管材内腐蚀失效脆弱性评价方法，首先，收集并分析含硫气田站场有关天然气、金属管道的基本参数；建立电化学腐蚀失效脆弱性评价耦合定量计算公式；建立环境敏感开裂腐蚀失效脆弱性评价耦合定量计算公式。其次，根据电化学腐蚀失效脆弱性评价耦合定量计算公式和环境敏感开裂腐蚀失效脆弱性评价耦合定量计算公式建立金属管材内腐蚀失效脆弱性评价耦合定量计算公式。最后，根据计算结果评价并验证金属管材内是否存在内腐蚀失效脆弱性。本发明能够从硫化氢腐蚀环境、管材和应力三方面因素进行耦合，全面、客观、系统地评价含硫气田站场金属管材内腐蚀失效脆弱性，并对其进行定量评价。
G01N3/08  ,一种合金材料力学性能的检测方法 [发明],本发明提供了合金材料力学性能的检测方法，属于合金材料力学性能检测领域。该方法包括：建立原始数据集、对原始数据进行预处理、判断点连通性等步骤。现有技术主要是通过力学实验检测合金材料力学性能，具有工序复杂，需要进行破坏试验、耗费时间及成本高等缺点。此外，由于影响材料力学性能的参数较多，若要通过计算模拟实现对合金材料力学性能的检测，较难选取有效参数并建立影响关系。本发明在未对合金材料进行破坏性实验的情况下，通过大数据选取合金材料力学性能的有效参数，并选用群论等数学工具，克服现有技术难以对有效参数进行判定的技术瓶颈，建立相关参数与合金材料力学性能的对应关系，实现对合金材料力学性能的精准检测。
G16C60/00  ,一种基于GA-ELM算法的纳米纤维平均直径预测方法 [发明],本发明公开了一种基于GA‑ELM算法的纳米纤维平均直径预测方法。在本发明中，包括以下特征：将静电纺丝工艺参数与平均纳米纤维直径作为训练样本，建立GA‑ELM预测纳米纤维直径模型，利用GA‑ELM算法实现对纳米纤维直径高效率，低成本的预测；直接将所需要预测的参数输入到已训练好的模型中，便可得到对应的纳米纤维直径预测值。本发明将遗传算法和极限学习机相结合的GA‑ELM模型，采用遗传算法对极限学习机的输入层权值和隐含层阈值进行优化，避免了输入层权值w和隐含层阈值b随机性对ELM预测精度的影响，提高了预测纳米纤维直径的准确率。
G16C60/00  ,基于机器学习的核材料热输运性质原子级预测方法及系统 [发明],本发明公开了基于机器学习的核材料热输运性质原子级预测方法及系统，属于模拟仿真技术领域。通过获取所需数据并识别为体系特征，通过网络获取数据集并进行分析处理，基于机器学习方法训练得到预测模型；初始化体系模型，在高剂量辐照损伤情形下进行热力学弛豫模拟、热差模拟；在模拟过程中，提取体系特征值并将其代入预测模型中，得到并计算体系热力学性质的预测结果，输出材料热导率；最后将体系信息和体系热力学性质的预测结果可视化。系统包括数据搜寻模块、训练模块、仿真模拟模块和结果输出模块。本发明简化了基于分子动力学对辐照损伤情形下核材料热输运性质的计算过程，解决了相关研究周期长、效率低的问题，并实现结果的可视化。
G16C60/00  ,基于深度学习的原子尺度高剂量辐照损伤预测方法及系统 [发明],本发明公开了基于深度学习的原子尺度高剂量辐照损伤预测方法及系统，属于仿真模拟技术领域。通过获取数据，并进行数据预处理；构建基于深度学习的预测模型并进行测试和调整；据体系建立相关参数和势函数，对原子体系进行初始化作用力和弛豫操作；根据预测模型预测弗兰克尔缺陷对的数量和位置，根据预测模型选择一个晶格原子和一个间隙位置，将选定的原子放置在新位置；进行能量最小化；迭代原子间作用力，更新原子位置；分析结果并将结果进行可视化操作。系统包括学习预测模块、模拟仿真模块和分析模块。本发明在节约计算成本的前提下，提升了高剂量辐照结果的科学性，减少了计算的时间复杂度，优化了高剂量辐照损伤模拟仿真步骤。
G01N23/2206  ,一种分析负极材料中磁性异物来源的方法 [发明],本发明公开了一种分析负极材料中磁性异物来源的方法。该方法包括：S1、将从负极材料中提取的磁性异物进行形貌分析和元素分析，获得负极材料中磁性异物的形貌谱图和元素谱图；S2、将从负极材料中提取的磁性异物的形貌谱图和元素谱图中获取的形貌信息和元素信息与负极材料的生产环境要素的形貌谱图和元素谱图的图库进行比对，判断获取的形貌信息和元素信息是否均相同：若两者均相同，确定该生产环境要素为负极材料中磁性异物的来源；若两者均不同或只有一个相同，确定该生产环境要素可能不是负极材料中磁性异物的来源。本发明提供的方法针对性强，排查结果可靠，可准确识别生产过程中磁性异物的来源渠道，提高负极材料的品质。
H02J13/00  ,一种基于精密测量技术的配电网线路态势感知方法 [发明],本发明涉及线路态势感知技术领域，具体公开一种基于精密测量技术的配电网线路态势感知方法，该方法包括：获取线路工作区域的环境参数进行分析，并匹配传感器数据修正因子；对配电网线路态势进行感知分析，并对异常态势进行警示反馈。本发明通过收集配电网线路工作区域的环境参数，分析环境因素对传感器收集数据的干扰程度，由此对传感器收集的数据进行修正，提高传感器收集数据的精确性，并通过监测开关柜内部的气体异常程度和声光异常程度，反映开关柜内部的局部放电程度，由此评估开关柜设备的绝缘缺陷的特性和损坏程度，降低电力运输安全隐患，同时对线路稳态电流和暂态电流进行监测，判断线路的负载状况，并对线路异常情况进行反馈，提高电力系统的安全性和稳定性。
G16C60/00  ,基于随机场模拟的腐蚀构件批量分析以及数据处理的方法 [发明],本发明提出基于随机场模拟的腐蚀构件批量分析以及数据处理的方法，属于一种通过二次开发的方法对随机场模拟的腐蚀构件进行性能分析以及数据处理的方法；本发明基于Python对Matlab‑ABAQUS软件进行二次开发，一方面实现了对随机场方法模拟得到的腐蚀构件进行力学性能分析，另一方面还可以实现批量操作，可以对模拟得到的腐蚀构件进行批量力学性能分析、后处理数据提取以及统计分析；本发明该方法的实现将会提高随机场模拟方法的效率，也能为腐蚀结构性能劣化预测分析以及后期结构的维护策略制定提供帮助。
G06F30/20  ,考虑降温速率的金属材料本构模型构建方法及装置 [发明],本发明提供一种考虑降温速率的金属材料本构模型构建方法及装置。该方法包括：在多个不同的试验温度下，对金属材料进行等温单轴拉伸试验，获取第一试验数据；基于第一试验数据确定第一基础模型的未知参数，确定拟合的高温本构模型；按照至少一个降温速率进行非等温单轴拉伸试验，获取第二试验数据；基于拟合的高温本构模型和第二试验数据，获取多个真实塑性应变‑应力差值数据对；基于多个真实塑性应变‑应力差值数据对和即时温度确定第二基础模型的拟合参数，确定拟合的应力差值模型；基于拟合的高温本构模型和拟合的应力差值模型，得到金属材料本构模型。本发明构建的本构模型考虑了降温速率，能更精准描述热冲压过程中材料的流变行为。
