IPC主分类,发明名称,摘要
G06F30/15  ,一种量化半钢子午线轮胎全生命周期环境影响的方法 [发明],本发明属于生命周期评价方法技术领域，涉及一种量化半钢子午线轮胎全生命周期环境影响的方法，包括目标和范围确定、清单分析、影响评价方法和结果分析。本发明从生命周期角度量化半钢子午线轮胎的环境影响，为轮胎全生命周期的合理规划能源和资源使用以及污染物排放提供依据；能够从各个环节、各项物料投入两种角度分析生命周期各阶段的贡献率，为针对性提高技术水平，研发新产品的同时减少环境影响提供具体的科学依据。
G16C60/00  ,一种基于机器学习的磷酸镁水泥基复合材料抗压强度预测方法 [发明],本发明公开了一种基于机器学习预测磷酸镁水泥基复合材料抗压强度的方法，首先对现有磷酸镁水泥基复合材料抗压强度试验数据进行搜集整理，制备多组磷酸镁水泥基复合材料样本并进行抗压强度试验，获得尽可能多的样本数据；将所有样本数据随机分割为训练数据集和测试数据集；建立五种机器学习模型，模型的输入参数包括每组磷酸镁水泥基复合材料的各组分占比、原料类型、试件尺寸等共计18个，输出参数为立方体抗压强度(CCS)；将数据代入到建立的五种机器学习模型中，根据输入的设计参数得到预测强度。具有良好的预测精度，取代了传统的通过大量浇筑养护试验来测定最佳配合比和抗压强度的方法，节省了大量的人力物力。
G06F30/20  ,含缺陷周期梁结构的频散特性分析方法 [发明],本发明公开了一种含缺陷周期梁结构的频散特性分析方法，属于工程结构缺陷计算分析领域，包括：根据断裂力学理论，计算构建含缺陷周期梁结构的裂纹的等效弹簧模型，并根据含缺陷周期梁结构的垂向振动控制方程，引入宏观尺度坐标、微观尺度坐标和无量纲频率进行两尺度渐近展开，得到含缺陷周期梁结构的宏观尺度上的等效频散方程，根据等效弹簧模型，分别在同相位条件下和异相位条件下对含缺陷周期梁结构在宏观尺度上的等效频散方程进行计算，得到含缺陷周期梁结构的频散特性。本发明能够高效分析缺陷对周期梁结构频散特性的影响，具有更高的计算效率，可高效地研究裂纹深度对周期梁结构频散特性的影响。
G16C20/30  ,医用同位素生产堆用硝酸铀酰溶液酸度设计方法及系统 [发明],本发明公开了一种医用同位素生产堆用硝酸铀酰溶液酸度设计方法，属于生产堆液体燃料设计技术领域。其包括：通过获得的R‑pH关系图，以及H＆lt;subgt;2＆lt;/subgt;O＆lt;subgt;2＆lt;/subgt;浓度限值与溶液pH的函数关系；计算出反应堆稳定运行时H＆lt;subgt;2＆lt;/subgt;O＆lt;subgt;2＆lt;/subgt;的平衡浓度以及反应堆稳定运行时溶液pH限值pH＆lt;subgt;limited＆lt;/subgt;，根据pH限值pH＆lt;subgt;limited＆lt;/subgt;，以设计初装料时硝酸铀酰浓度中添加的自由硝酸浓度。本发明提供的医用同位素生产堆用硝酸铀酰溶液酸度设计方法，可获得硝酸铀酰溶液的运行pH限值，提供设计出合理的反应堆硝酸铀酰初始自由硝酸浓度，同时还能设计提供运行时合理的补酸频率和补酸浓度，可解决液体燃料溶液的酸度设计和运行时的安全设计问题，实现以水溶液为核燃料医用同位素生产堆经济、安全可靠运行。
G16C20/40  ,一种基于气候因子的烟叶烟碱含量预测方法及系统 [发明],本说明书实施例提供了一种基于气候因子的烟叶烟碱含量预测方法及系统，其中，方法包括：对烟叶产地气候因子进行分析，确定影响烟草生长的关键气候因子，对所述关键气候因子进行特征重构；根据关键气候因子往年气候数据及其对应年份烟叶的烟碱含量构建数据集，将所述数据集划分为训练集和测试集；基于GRU神经网络构建烟叶烟碱含量预测模型，通过所述数据集对构建的烟叶烟碱含量预测模型进行训练和测试；使用测试好的烟叶烟碱含量预测模型对烟叶的烟碱含量进行预测。本发明基于气候因子对烟叶烟碱含量进行预测，具有较高的准确率和可行性。
G01N21/25  ,土壤锗元素含量的确定方法 [发明],本发明的实施例涉及土壤元素含量测量技术领域，具体涉及一种土壤锗元素含量的确定方法，其包括步骤：获取待测区域的高光谱数据；获取待测区域内多个采样点处的光谱数据以及土壤的锗元素含量和多个土壤指标；根据采样点的光谱数据、多个土壤指标和锗元素含量，确定多个土壤指标中与锗元素含量相关的土壤指标影响因子以及光谱中与锗元素含量相关的特征波段；根据采样点的锗元素含量、土壤指标影响因子和特征波段对应的光谱数据以及待测区域的高光谱数据，确定待测区域的锗元素含量。使用本申请实施例提供的方法，能够有效提升土壤锗元素含量的高光谱反演精度，满足实际调查需求，提高调查效率。
G16C60/00  ,橡胶动态力学性能测试方法、系统以及存储介质 [发明],本发明公开了一种橡胶动态力学性能测试方法、系统以及存储介质，涉及橡胶性能测试领域，用以更加精准地测试橡胶的动态力学性能。橡胶动态力学性能测试方法包括以下步骤：根据橡胶的温度变量，计算得到第一动态模量变化量；根据橡胶的频率变量，计算得到第二动态模量变化量；根据第一动态模量变化量和第二动态模量变化量，计算得到橡胶同时耦合频率变量和温度变量的橡胶本构模型；根据温度谱试验数据，建立与存储模量相关的第一目标函数、与损耗模量相关的第二目标函数；根据橡胶本构模型、第一目标函数和所述第二目标函数，测试橡胶的动态力学性能。上述方法，可以精准地描述温度和频率对动态力学性能参数的影响规律。
G16C60/00  ,智能压电复合材料层间应力预测方法、介质、设备及装置 [发明],本发明公开了一种智能压电复合材料层间应力预测方法、介质、设备及装置，其中方法包括：获取组成比例信息，并根据组成比例信息计算材料属性；基于一阶剪切变形理论和锯齿函数生成精化锯齿模型；获取层间剪切应力场，并生成精确层间剪切应力场；基于精化锯齿模型和精确层间剪切应力场构造三节点三角形板单元，并推导出待预测产品的单元刚度矩阵；基于单元刚度矩阵生成全局平衡方程，并将材料属性代入全局平衡方程进行计算，以得到未知位移；计算待预测产品对应的最终层间剪切应力；能够对压电复合材料层板在力电耦合效应下的层间剪切应力分布进行精确预测，提高压电复合材料在场景应用时的可靠性和安全性。
G16C20/30  ,一种预测城市固废焚烧过程氮氧化物排放量的方法 [发明],本发明一种预测城市固废焚烧过程氮氧化物排放量的方法，涉及城市固废焚烧预测氮氧化物排放量方法，具体步骤如下：(1)收集城市固废焚烧(MSWI)过程中的气体排放数据和其他特征数据。(2)使用斯皮尔曼相关系数法选取与烟气中氮氧化物浓度相关性高的特征作为协变量。(3)构建预测模型。(4)使用标准化后的训练数据集对氮氧化物排放量预测模型进行训练。(5)将MSWI过程氮氧化物的历史数据及其对应时间段的协变量特征数据输入氮氧化物排放量预测模型，得到氮氧化物排放的预测值。本发明提高了MSWI过程中氮氧化物排放量预测的准确性、可解释性，为智能优化控制系统提供决策支持，同时最小化资源消耗，实现了系统控制的精准化。
G06F30/15  ,一种船舶用水润滑轴承轴瓦板条材料对比选型方法 [发明],本发明提出一种船舶用水润滑轴承轴瓦板条材料对比选型方法，包括如下步骤：a，针对水润滑轴承轴瓦材料的选型，确定为三个方面的性能对比：在极限工况下的工作能力、摩擦性能、尺寸稳定性；b，以对比选型评分的办法对上述三种性能进行评分，打分权重向极限工况下的工作能力方面倾斜，设置各评价指标的分值；c，选定多种板条材料为轴瓦的轴承试样，针对三种性能的对比，分别设置对比试验进行试验，对比各试样的试验结果，采用专家评判法，按照各项测试数据排序，最后对比各种选型的最终得分，分数高即为选定材料，本发明构建了一套基于同一标准和试验办法的轴瓦材料性能比测办法，为轴承板条材料择优得以实际开展和后续公平考评试验奠定基础。
G16C60/00  ,考虑微观失效机理的2.5维机织复合材料多尺度分析方法 [发明],本发明公开一种考虑微观失效机理的2.5维机织复合材料多尺度分析方法，包括建立2.5D机织复合材料细观和微观单胞有限元模型、对微观单胞有限元模型赋予组分材料性能和施加周期性边界条件，获取微观单胞模型等效弹性参数和每个单元的应变‑应力放大因子、利用K‑means聚类算法，以微观单胞模型中各单元的应变‑应力放大因子为特征数据，对微观模型进行聚类降阶，并以每个聚类中单元的应变‑应力放大因子的平均值作为聚类的应变‑应力放大因子、对细观单胞有限元模型赋予组分材料性能和施加周期性边界条件，等，本发明基于微观失效理论，从微观模型尺度分析在复合材料损伤过程中纤维单丝以及基体的损伤机理。
G16C60/00  ,一种绝缘油基础油的筛选方法及系统 [发明],本发明涉及电力设备绝缘油合成的技术领域，公开了一种绝缘油基础油的筛选方法及系统，其中方法包括按照第一性原理计算多种待评估基础油的各项性能指标对应的理论指标数据；分别计算各项性能指标对应的主观权重和熵权；采用主观权重和熵权计算待评估基础油的综合权重指标矩阵；按照综合权重指标矩阵和理论指标数据绘制各待评估基础油对应的雷达图，并根据雷达图计算各待评估基础油的评估值；根据各待评估基础油的评估值选择目标基础油。本发明通过雷达图形式，直观展示了不同基础油的各项性能，并实现了对绝缘油合成原料中的基础油的定量评估，可直接根据基础油的评估值大小对基础油进行筛选，提高了绝缘油基础油筛选的效率。
G06F30/27  ,一种基于机器学习的镁合金热处理工艺优化方法 [发明],本发明涉及工艺优化方法技术领域，具体涉及一种基于机器学习的镁合金热处理工艺优化方法，包括以下步骤：设计正交实验工艺参数，并获取镁合金的力学性能实测值，根据该工艺参数和力学性能实测值构建数据集；选取数据集中已测试性能的数据作为训练集数据，未被测试性能的数据作为待预测数据集；构建机器学习模型；将机器学习模型应用于待预测数据集，得到其预测分布，使用全局最优算法ego计算期望提高，并测试合金的力学性能；若所选择的工艺测试性满足需求，则停止并完成工艺参数优化，若不满足，则继续执行，直至满足需求。本发明，利于全面、系统地探索和理解各工艺参数对镁合金力学性能的影响，有助于从宏观上把握镁合金的性能变化规律。
G16C10/00  ,一种耦合纳米孔隙限域效应的扩散系数计算方法 [发明],本发明属于非常规油藏开发技术领域，尤其涉及一种耦合纳米孔隙限域效应的扩散系数计算方法，首先获取致密储层的纳米孔隙中组分的参数数据；然后将获取的参数数据输入两相闪蒸计算模型中计算相平衡组成和计算化学势，生成热力学因素矩阵参数；接着计算理想条件下和系统条件下的组分摩尔密度、黏度；然后计算给定温度、压力下的二元扩散系数，并根据相平衡组成计算无限稀释溶剂的扩散系数，生成矩阵B；最后求取矩阵B的逆矩阵和将热力学因素矩阵参数生成热力学因素矩阵，根据矩阵B的逆矩阵和热力学因素矩阵生成扩散系数矩阵，输出对应组分的扩散系数。本发明能够实现非常规油藏开发过程中致密储层多组分分子扩散的准确计算。
G16C60/00  ,C50自密实混凝土28d抗压强度的预测方法 [发明],本发明提出一种C50自密实混凝土28d抗压强度的预测方法，具体为根据水泥28d抗压强度、水泥占胶凝材料质量比和水胶比计算C50自密实混凝土28d抗压强度的数学模型。使用时，首先按《自密实混凝土应用技术规程》JGJ/T283 2012的要求选择原材料并进行配合比设计。其次，进行配合比的适配、调整直至拌合物自密实性能满足设计要求时确定基准配合比。最后，利用本发明提出的数学模型进行混凝土28d抗压强度的预测。通过对56组不同配合比的C50自密实混凝土的试验结果进行预测，结果表明预测值与实测值的平均误差仅为3％，说明本发明的预测方法的预测精度高，而且可有效节约时间及成本。
G06F30/10  ,雷电流连续组合分量的电热仿真方法 [发明],本发明公开了一种雷电流连续组合分量的电热仿真方法，具体为：步骤1，建立仿真几何模型并定义边界条件；步骤2，给几何模型施加电流分量1并将所有变量初始值设置为常温下的值，然后计算所有变量的值；步骤3，电流分量1加载完成后，用下一个电流分量作为电流分量1将其电流、热流载荷继续给几何模型施加，并将所有变量初始值设置为步骤2计算的电流分量1最后一个时间步所有变量的值，计算所有变量的值，重复执行步骤2‑3，直至完成所有电流分量的施加，并输出计算结果。本发明解决了现有技术中存在的雷电环境下结构的电热耦合损伤仿真计算时只采用一种电流分量无法准确模拟真实的雷电流对材料的作用过程的问题。
G16C20/20  ,气味化合物检测方法、装置、计算机设备和存储介质 [发明],本申请涉及一种气味化合物检测方法、装置、计算机设备和存储介质。所述方法包括：获取多个啤酒样本的成分数据信息，并识别各所述成分数据信息中的气味数据信息；解析各所述气味数据信息，得到各气味化合物的子成分数据信息，并基于每个气味化合物的各子成分数据信息，识别每个气味化合物中的关键气味活性物质的各数值信息；基于各所述关键气味活性物质的数值信息，建立啤酒风味的风味特征指纹图谱。采用本方法能够准确解析啤酒中有气味贡献的化合物，减少非关键气味化合物带来的干扰。
G16C60/00  ,一种流动胶浆型沥青混合料设计方法 [发明],本发明涉及沥青混合料设计技术领域，尤其是涉及一种流动胶浆型沥青混合料(Fluid Mastic Asphalt，FMA)设计方法。包括以下步骤：骨架设计、胶浆设计、配合比计算、混合料制备与成型和体积指标验证。本发明提供的设计方法基于胶浆流动制备得到流动胶浆型沥青混合料，易于形成紧密骨架结构，内部空隙小，属于骨架超密实型沥青混合料，在保证抗车辙能力的前提下，拉伸变形能力和延展性大大提升，解决了沥青路面水损害的顽疾，疲劳寿命成倍提升。
G16C60/00  ,增强面板的夹层结构屈曲荷载预测方法、设备及装置 [发明],本发明公开了一种增强面板的夹层结构屈曲荷载预测方法、介质、设备及装置，其中方法包括：获取待预测增强面板的组分相关比例，并根据组分相关比例计算待预测增强面板的材料属性；基于正弦五参数理论和二阶锯齿位移函数生成修正五参数模型；基于虚位移原理和修正五参数模型生成待预测增强面板的平衡方程；基于纳维解法和平衡方程计算简支边界条件下待预测增强面板的夹层的边界条件阈值，并根据边界条件阈值获取相应的位移参数，以及根据位移参数、材料属性和平衡方程计算待预测增强面板对应的屈曲荷载；能够有效提高增强面板的加测结构屈曲荷载的计算效率，同时，提高屈曲荷载预测结果的准确性。
G16C20/20  ,一种低聚物识别方法、装置、计算机系统及存储介质 [发明],本申请提供了一种低聚物识别方法、装置、计算机系统及存储介质，方法包括对待检测物进行质谱分析，获取待检测物中所有物质的质谱特征峰以及部分物质对应的串联质谱；根据串联质谱以及预先构建的聚合物低聚物数据库从待检测物中的部分物质中确定出种子低聚物；根据种子低聚物、所有物质的质谱特征峰和聚合物低聚物数据库以及低聚物端基数据库进行同系物以及同源物筛选，从待检测物中的所有物质中筛选出种子低聚物的目标同系物和目标同源物，根据目标同系物和目标同源物生成待检测物的低聚物识别结果。本申请方案提供的低聚物识别方法，对于低聚物的筛查和鉴定，置信度高、假阴性率低、步骤简洁高效，并且可以用于筛查和识别已知和未知低聚物。
G16C20/70  ,一种药物活性检测方法 [发明],本发明公开了一种药物活性检测方法，属于药物检测技术领域，该检测方法具体步骤如下：(1)收集并预处理大量药物活性数据；(2)基于收集到的数据构建药物活性的知识图谱；(3)提取药物特征以训练药物活性预测模型；(4)对新的药物分子进行活性预测并生成活性预测报告；(5)通过LUR链表记录药物分子预测结果并定期更新；(6)将模型嵌入用户平台中以供用户进行活性预测服务；本发明能够提高药物活性预测的准确性，拓展药物活性预测的适用范围，提高使用广泛性，有效提高药物活性预测的效率，加速药物研发的过程，能够不再依赖于静态的周期性更新，实现模型参数的实时动态调整，提高用户对模型预测的满意度，同时提高数据调用效率。
C02F9/00  ,工业废水分质处理与回用系统的碳排放评估方法及系统 [发明],本发明公开了一种工业废水分质处理与回用系统的碳排放评估方法，涉及污水处理碳排放核算技术领域，该方法包括：按照不同废水排放或回用需求，对工艺路线进行分类；确定工业废水分质处理与回用系统的核算边界，并确定各核算边界对应的工艺路线；基于核算边界对应的工艺路线，根据生命周期评价法中的组织碳排放核算规则建立工业废水分质处理与回用系统碳核算模型；工业废水分质处理与回用系统碳核算模型包括碳排放总量计算模型和碳排放总强度计算模型；基于工业废水分质处理与回用系统碳核算模型进行碳排放评估。本发明能够为工业废水处理与回用系统提供可靠可行的碳排放核算与评估路径。
G01N3/20  ,一种脆性材料断裂特性规律测试及预测方法 [发明],本发明公开一种脆性材料断裂特性规律测试及预测方法，属于材料性能表征领域。本发明基于力值加载系统、力值载荷测量系统、断裂时间测量系统建立了脆性材料断裂特性的测试方法，基于神经网络算法建立了脆性材料断裂特性规律的预测模型，实现了对微系统封装内部常用脆性材料断裂幅值和断裂时间的同步测量，以及对不同材料材质、外形尺寸、裂纹尺寸条件下的脆性材料断裂特性规律的准确预测。因此，本发明的规律测试及预测方法对于准确掌握脆性材料的断裂特性规律，有效降低微系统产品发生脆性断裂失效的风险，以及指导微系统封装尺寸结构的科学设计和内部材料类型的合理选取具有重要意义。
G06F30/13  ,一种采空区下具有顶板间隔层巷道的支护方式判断方法 [发明],本发明公开了一种采空区下具有顶板间隔层巷道的支护方式判断方法，属于地下工程施工技术领域，包括以下步骤：S1、确定上层煤直接顶厚度，且通过岩层柱状图确定上层煤基本顶构成；并计算下层煤顶板所受均布荷载；S2、确定下层煤巷道顶板组合梁临界跨厚比，得到巷道顶板最小自稳定厚度t＆lt;subgt;min＆lt;/subgt;；S3、确定下层煤顶板实际未破坏厚度t＆lt;subgt;r＆lt;/subgt;，且通过t＆lt;subgt;r＆lt;/subgt;与t＆lt;subgt;min＆lt;/subgt;的对比来判断隔层巷道的支护方式；本发明进一步优化了巷道的支护方式，改变了这类巷道的支护加固设计长期依赖于经验的现状，依据材料力学原理，将顶板组合梁极限跨厚比作为判断顶板自稳定性的依据，实现了支护方式的定量化判断。
G16C20/30  ,转化产物性能预测方法、装置、电子设备及存储介质 [发明],本发明一方面提供了一种基于机器学习的木质纤维素生物质转化产物性能预测方法，包括：获取木质纤维素生物质的转化工艺数据；对转化工艺数据进行归一化处理，得到归一化后的转化工艺数据；将归一化后的转化工艺数据输入至经训练的转化产物性能预测模型，预测木质纤维素生物质的转化产物性能。
G16C20/20  ,一种用于检测块煤灰分的方法、系统、设备和存储介质 [发明],本申请公开了一种用于检测块煤灰分的方法、系统、设备和存储介质。所述方法包括：根据预先采集的多组块煤的高低能数据计算所述每组块煤中单块煤的单物质特性系数；对所述每组块煤中的单块煤进行分类，以将所述每组块煤中的单块煤划分成不同类别；根据所述单块煤的单物质特性系数计算相应类别下每组块煤的整体物质特性系数，并测量相应类别下每组块煤的灰分值；基于所述整体物质特性系数和所述灰分值构建相应类别下灰分和整体物质特性系数的关系模型；以及根据所述关系模型检测实时采集的块煤的灰分值。利用本申请的方案，可以提高块煤灰分检测结果的精度。
G16C60/00  ,基于密度泛函理论来分析互金属化合物的方法及系统 [发明],本发明属于材料技术领域，公开了一种基于CASTEP的第一性原理密度泛函理论(DFT)来分析互金属化合物。本发明用第一原理计算方法计算了AB3(A＝镨(Pr)、钕(Nd)，B＝铟(In))材料的热电性能。这些化合物是金属性质的，通过它们的能带结构和自旋密度显示出来。在计算热电性能时，采用了半经验玻尔兹曼方法，应用了BoltzTraP代码。PrIn3和NdIn3已经被证明是高值的热电材料，由于其高的热电性能指标。这些元素可以在需要巨大强度的电路中有效地应用。
G16C20/50  ,一种阻垢剂设计方法及阻垢剂 [发明],本发明提出了一种阻垢剂设计方法及阻垢剂，所述阻垢剂设计方法包括分别计算若干个有机单体与钙垢晶体的结合能，结合各有机单体的静电势能图确定第一目标有机单体；通过逐步计算分子对与三元体系与钙垢晶体的结合能，结合相对应的静电势能图、各基团的ESP极值点并进行AIM分析极值点处电子密度ρ和拉普拉斯电子密度分析最终得到第一目标三元阻垢剂体系。该方法简单、可靠、高效，可避免使用含磷元素或其他有害化学物质的使用；该方法所得到阻垢剂的阻垢性能高效、稳定，不含磷元素及其他有害化学物质，绿色环保。
G16C20/70  ,一种木片材性品质及化学机械法制浆性能综合评价方法 [发明],本发明公开了一种木片材性品质及化学机械法制浆性能综合评价方法。该方法包括如下步骤：对木片进行多次取样，测试木片各项材性指标并计算平均值和标准偏差；将材性指标分组合并为物理品质、化学品质、抽出物品质和纤维品质，采用模糊评价方法评价木片材性品质等级并计算材性品质评价得分；将材性品质评价得分、制浆过程参数作为输入值，相应的制浆性能指标作为输出值，建立神经网络模型用于预测评估制浆性能。该方法通过对制浆过程关键材性指标的分析归纳，多维度、定量化评价木片材性品质，结合机器学习算法建立制浆性能预测模型，能够快速高效评价木片化学机械法制浆适应性，为制浆生产企业高效管理生产原料、智能调控生产工艺提供技术支撑。
