IPC主分类,发明名称,摘要
G16B5/00  ,一种基于秸秆的生物乙醇生命周期评价方法及系统 [发明],本发明公开了一种基于秸秆的生物乙醇生命周期评价方法及系统，涉及生物乙醇生命周期评价技术领域，包括采集秸秆生物特征数据，建立秸秆品质评估模型；基于秸秆品质对秸秆进行预处理，进行生物乙醇发酵；对生物乙醇发酵过程进行监测，通过生物乙醇参数建立生命周期评价体系，定期对生物乙醇生产流程进行更新优化。本发明所述方法通过建立秸秆品质评估模型提升了原料利用效率，提高生物乙醇产品的质量和可靠性；通过秸秆被分类为不同的品质等级，并采用相应的预处理方法，提高了原料的转化效率，还降低了生产成本和环境影响；通过生物乙醇参数建立生命周期评价体系，定期对生物乙醇生产流程进行更新优化，保证了生产工艺的现代化和高效性。
G16C20/20  ,一种利用LC-MS数据分析药用植物化学成分的方法 [发明],本发明提供一种利用LC‑MS数据分析药用植物化学成分的方法，涉及LC‑MS数据分析药用植物技术领域。该一种利用LC‑MS数据分析药用植物化学成分的方法，包括以下步骤：S1、首先针对每个药用植物的化学成分通过LC‑MS进行识别，同时保留药用植物化学成分的详细数据对其进行数据储存；S2、在药用植物化学成分识别完成之后对其做出总集成，将各个数据进行排列。该方法能够对药用植物的化学成分进行筛选分析，利用筛选固定值条件进行排除筛分，可自我的将达标的数据进行整理，将不达标的数据进行排除，使整个分析流程更加的清晰，结果更加的明了精确，解决了现有的药用植物化学成分分析不够精确的问题。
G01N33/18  ,用于解析混合作用下浅层湖泊湖水盐分变化关键过程的实验方法 [发明],本发明公开了用于解析混合作用下浅层湖泊湖水盐分变化关键过程的实验方法，具体为通过获取湖泊水的数据进行实验，选定实验过程中某时间段湖泊水盐分中主要离子浓度和氢氧稳定同位素值，分析提出基于水循环的湖水盐分优化调控方案；通过智能化实验装置的方式实现混合作用下浅层湖泊湖水盐分变化关键过程的解析，解决了现有技术中长时间的动态观测中取样过程需要耗费大量人力的问题。
G16C10/00  ,分子模拟增强采样方法、装置、电子设备及可存储介质 [发明],本申请提供一种分子模拟增强采样方法、装置、电子设备及可存储介质，该方法包括：确定初始集体变量CV；通过所述初始CV和初始模拟采样获取到初始训练集；其中，所述初始模拟采样为无偏势模拟采样；根据所述初始训练集和神经网络模型训练至少一个偏势模型；对所述至少一个偏势模型进行至少一轮的迭代，其中，在一轮所述迭代中：根据所述至少一个偏势模型进行增强采样，根据所述增强采样得到的数据获取更新的训练集，根据所述更新的训练集重新训练所述至少一个偏势模型。本申请的技术方案可以改善偏势力场模型的质量。
G16C60/00  ,用于堆芯核设计程序的结果输出方法、系统、设备及介质 [发明],本发明公开了用于堆芯核设计程序的结果输出方法、系统、设备及介质，涉及数值计算领域，其技术方案要点是：预先配置堆芯的堆芯参数，其中堆芯参数包括几何参数和材料参数；由堆芯核设计程序计算所述堆芯参数，得到维度为节块级的结果参数，将节块级的结果参数转换为堆芯核设计程序所需的组件级参数，其中所述组件级参数包括三维组件级参数、二维组件级参数、一维组件级参数和堆芯平均参数；预先配置用于存储堆芯核设计程序结果输出的体系结构；按照所述体系结构的文件格式和参数排列顺序存储所述组件级参数，得到设计文件；将设计文件按照堆芯组件核设计的量纲范围，以预设的输出格式进行输出或展示。
G16C20/70  ,一种对厌氧废水处理工艺进行监测的方法 [发明],本发明公开了一种对厌氧废水处理工艺进行监测的方法，涉及厌氧废水处理技术领域，所述方法包括：建立知识库，所述知识库用于存储理论知识和经验数据；建立综合数据库，所述综合数据库用于存储用户输入信息转化成的计算机语言形式的初始数据、推理程序求解过程中得到的中间数据和最终结果的数据；获取厌氧废水处理工艺的监测数据；根据所述知识库，所述综合数据库和所述监测数据，通过推理程序确定对所述监测数据的判断结果。能够对厌氧反应系统中的扰动抑制的发生、扰动抑制因素类型和绕顶抑制程度、扰动抑制终点和厌氧反应器恢复情况等进行快速、准确、全面的诊断，并给出详细且便于理解的判断信息。
G06F18/2413  ,一种流域水环境生态治理预警方法及系统 [发明],本发明公开了一种流域水环境生态治理预警方法及系统，涉及环境科学和工程技术领域，该系统的设计旨在通过均匀分布多个监测点，并实时监测各监测点的数据信息，该系统能够有效获取河滩地周围水环境的实时状态，以便为后续的反推非点源的具体位置做基础，并截取某两个检测点的总污染物浓度，以获取浓度差值，再通过对浓度初始比例值Csbl和浓度降低比例值Ndbl的计算和比较，获取路径倍数Ljbs，从而初次确定非点源处距离监测点的一号路距Lj1和二次确定二号路距Lj2，以对非点源处进行二次锁定，并调整二次判定非点源处总污染物浓度Fndz＆lt;subgt;2＆lt;/subgt;，将其与预先设置的阈值Q进行对比，实现实时的预警管理，并根据对比结果，能够发送不同等级的预警通知。
G16C20/70  ,一种基于图神经网络的原子间相互作用势构建方法及系统 [发明],本发明公开一种基于图神经网络的原子间相互作用势构建方法及系统，涉及机器学习技术领域，该方法包括获取目标材料的初始数据集；初始数据集包括若干目标材料三维结构；获取每一目标材料三维结构对应的图；构建目标材料三维结构中的每一原子的距离对称函数；将目标材料三维结构对应的图的图描述符矩阵和目标材料三维结构中所有原子的距离对称函数输入至训练好的性能参数预测模型中，得到目标材料三维结构对应的性能参数；所有目标材料三维结构对应的性能参数构成原子间相互作用势。本发明采用训练好的性能参数预测模型进行性能参数预测，提高了原子间相互作用势的构建效率和精度。
G16C60/00  ,一种复合材料结构损伤监测方法、装置、介质及设备 [发明],本发明涉及复合材料结构健康监测技术领域，特别涉及一种复合材料结构损伤监测方法、装置、介质及设备。包括：通过多功能传感网络和有限元数值模拟获得第一结构参数；通过Teager能量算子和多尺度排列熵对第一结构参数进行损伤特征信息提取，获得第二结构参数；将第二结构参数输入生成对抗网络获得第三结构参数；将第二结构参数和第三结构参数融合生成复合材料结构状态完备参数；将复合材料结构状态完备参数输入复合材料结构损伤识别模型，以得到复合材料结构的损伤定位和损伤定量结果。利用多功能传感网络、有限元数值模拟和生成对抗网络三者结合获取复合材料结构状态完备参数，经济且有效地获得了复合材料结构状态完备参数。
G06N3/0464  ,一种基于分层池化图哈希的图数据检索模型训练方法 [发明],本说明书公开了一种基于分层池化图哈希的图数据检索模型训练方法，待训练的检索模型包含编码子模型和预测子模型，所述编码子模型包含卷积层和编码层，所述卷积层包含嵌入子层、分配子层以及输出子层。在编码子模型的各层卷积过程中，实现了对上一层卷积层特征矩阵表示的节点特征的聚合，以及对上一层卷积层邻接矩阵表示的节点个数的聚合，使得每个卷积层得到的特征矩阵都保留了图数据的结构信息。根据特征矩阵得到图特征，再根据图特征得到图数据的图哈希码，因为特征矩阵保留了图数据的结果信息，所以得到的图哈希码更加准确，在根据图哈希码进行图数据检索时，得到的检索结果也更加准确。
G16C60/00  ,一种混凝土几何曲折度预测方法 [发明],本申请涉及借助于测定材料的化学或物理性质来测试或分析材料技术领域，提供一种混凝土几何曲折度预测方法。该方法首先利用水泥颗粒形状因子和水灰比的影响修正系数对预先构建的理想形状下硬化水泥浆体的几何曲折度模型进行一次修正，然后利用硬化水泥浆体的曲折度模型，根据砂浆中规则砂粒的形貌特征和排列方式，构建砂浆的几何曲折度模型、混凝土的几何曲折度模型；接着，使用骨料颗粒形状因子对砂浆的几何曲折度模型、混凝土的几何曲折度模型进行二次修正，得到修正后的混凝土的几何曲折度模型。该方法在建模过程中充分考虑了水化产物、骨料形貌特征、水化程度等多种因素对孔隙结构的影响，提高了混凝土的几何曲折度预测精度。
G16C20/40  ,一种化学分子结构的搜索方法 [发明],"本发明公开了一种化学分子结构的搜索方法，包括：将待搜索的化学分子结构式的每个原子分别作为顶点，将原子之间的化学键作为边，从而构建化学分子图G(V,E)；计算待搜索的化学分子图G(V,E)中所有原子顶点的[t,p]‑阶；对待搜索的化学分子图G(V,E)的所有原子顶点的[t,p]‑阶进行处理，得到待搜索的化学分子图G(V,E)的不同特征信息；将待搜索的化学分子图G(V,E)的若干种特征信息分别与数据库中的任一化学分子图G'(V',E')的若干种特征信息进行比较，若存在相同的特征信息，则表示G'(V',E')即为G(V,E)的相同化学分子结构，并输出，否则，表示G(V,E)在数据库中未搜索到相同化学分子结构。本发明将化学分子结构式转换为图，并利用图顶点的[t,p]‑阶提取特征信息，从而能更为准确、高效的搜索化学分子结构。"
G06F30/13  ,基于透水率的灌浆地质模型的灌浆单元施工顺序优化方法 [发明],本发明为基于透水率的灌浆地质模型的灌浆单元施工顺序优化方法，所述方法利用透水率数据建立灌浆地质模型，基于灌浆地质模型计算灌浆单元适合优先灌浆的程度，得到考虑地质条件的灌浆单元施工顺序。在灌浆工程建模方面，本发明引入随机场法，考虑了由于地质体固有的变异性以及传统插值建模方法忽略的不确定性，通过结合透水率建立灌浆地质模型，提出优先灌浆指标判定灌浆单元是否适合优先灌浆。在考虑灌浆复杂地质条件的情况下为施工人员提供了一个可供参考的灌浆施工单元的施工顺序。
G16C10/00  ,一种计算微纳米孔中流体饱和压力的分子模拟方法及系统 [发明],本发明公开了一种计算微纳米孔中流体饱和压力的分子模拟方法及系统，该方法包括如下步骤：S1：建立干酪根分子模型，并进行干酪根分子弛豫和几何优化；S2：将优化后的干酪根分子建立无定形晶胞，得到页岩初始模型；S3：对页岩初始模型进行密度收敛，建立页岩基质模型，通过页岩基质模型模拟不同有机页岩储层的有机孔隙；S4：基于页岩基质模型，建立页岩狭缝孔隙模型，通过页岩狭缝孔隙模型测定不同条件下的原油饱和压力。本发明可以模拟不同有机页岩储层的有机孔隙，测定不同条件下的原油饱和压力。
G16C10/00  ,一种芳烃歧化和烷基转移的反应器模型 [发明],本申请实施例提供了一种芳烃歧化和烷基转移的反应器模型，该反应器模型由若干组平推流反应器及平衡反应器串联组成；基于每一组平推流反应器及平衡反应器中的进料集总，将满足预设反应速率的反应对应的反应组分作为集总组分；采用动力学计算，对集总组分进行计算，获得每一组平推流反应器及平衡反应器的产物组成；对每一组平推流反应器及平衡反应器的产物组成去集总，转化为目标物质；使用平衡方程计算，获得目标物质的各个组分的组成；将目标物质的各个组分的组成作为下一组平推流反应器及平衡反应器的进料集总，进行循环，计算所述反应器模型的各组平推流反应器及平衡反应器的目标物质的各个组分的组成，获得所述反应器模型的最终组分的组成。
G16C60/00  ,一种水泥石几何曲折度预测方法 [发明],本申请涉及借助于测定材料的化学或物理性质来测试或分析材料技术领域，提供一种水泥石几何曲折度预测方法。该方法首先基于水化程度建立水泥石几何曲折度模型；水泥石几何曲折度通过未水化水泥颗粒的几何曲折度和完全水化水泥颗粒的几何曲折度的平均值表达；水泥颗粒的几何曲折度是基于扩散离子在孔隙中的传输有效路径建模得到的，传输有效路径是根据水泥颗粒的形貌特征和排列方式确定的，传输有效路径包括有效长路径和有效短路径；有效长路径为孔隙管道的中心线，有效短路径为孔隙管道中贴近水泥颗粒的最短路径；利用所建立的水泥石几何曲折度模型获取水泥石几何曲折度的模拟值。该方案通过合理确定传输路径，提高水泥石曲折度模拟精度。
G06F30/20  ,一种基于Modelica语言的锅炉炉膛燃烧建模方法 [发明],本发明公开了一种基于Modelica语言的锅炉炉膛燃烧建模方法，通过燃烧及传热机理模拟锅炉炉膛内复杂的燃烧过程，基于Modelica语言在OpenModelica软件中搭建炉膛燃烧模型，将整个燃烧系统模块化，通过空气和燃料输入接口进行数据输入，输入为：空气的质量流量、压力、温度、空气中各气体质量分数和燃料的质量流量、温度、成分。输出为：炉膛烟气出口温度、烟气质量流量、炉膛容积热负荷、炉膛断面热负荷等。本发明搭建的锅炉炉膛燃烧模型，其各项数据精度较高，模型可扩展性强，可应用于锅炉设计与优化领域。
G16C20/20  ,一种考虑冷却塔雾羽沉降的环境腐蚀性评估方法 [发明],本发明属于金属腐蚀评估领域，涉及一种考虑冷却塔雾羽沉降的环境腐蚀性评估方法，通过水汽扩散模型确定某时刻水分沉积量，结合该地区蒸发速率确定液膜作用时间，代入液膜厚度与腐蚀速率关系积分获取此时段液体沉积对腐蚀失重影响，进而评估因冷却塔雾羽沉降导致的腐蚀加剧情况。该方法具有较强的操作性，可定量评估冷却塔周边区域因水分沉降导致的腐蚀变化情况，有效指导冷却塔周边工程差异化选材、防腐及运行维护。
G16C20/30  ,一种预测酱油货架期产气量的方法 [发明],本发明涉及调味品贮藏技术领域，具体涉及一种预测酱油货架期产气量的方法。本发明首次利用数学模型将酱油产气量与酱油中基础物质的含量相联系，通过测量酱油中特定氨基酸、糖类基础物质的含量即可预测在无微生物污染的情况下，酱油在货架期的产气量，方法简单快速，操作简单，预测精准度和可靠性高。通过预测酱油在货架期的产气量，有助于提前评估可能存在的货架期风险，指导设计相关预防和改进措施，可以为酱油的酿造提供更好的技术支持。
G06F30/13  ,一种三段式预制桥墩的吊装设计方法 [发明],本发明公开了一种三段式预制桥墩的吊装设计方法，属于桥墩吊装设计领域，包括如下步骤：S100、确定结构形式：确定预制桥墩为三段式结构分别独立预制的上节预制墩帽，中节预制墩身以及下节预制墩台；S200、确定上节预制墩帽，中节预制墩身以及下节预制墩台的荷载及系数；S300、吊点及吊装组件设计；S400、吊装组件参数设计；S500、有限元模型分析；本发明针对分段构件的吊点预埋件进行设计，并给出吊点的合理位置，组成完整的吊装系统。吊装构件的吊杆、吊耳、锚垫板在吊装设计荷载作用下的应力值均小于对应材料的设计强度，能够满足吊装施工的要求；混凝土结构在底部锚垫板处的抗冲切承载力满足吊装施工的荷载要求。
G16C20/10  ,一种光伏子阵接地系统设计评价方法 [发明],本发明涉及光伏发电技术领域，且公开了一种光伏子阵接地系统设计评价方法，通过现场实证的方法测试当地光伏电站的土壤腐蚀率，以获得较为准确的接地材料的腐蚀速率，通过计算的方法评估已建光伏电站的设计采用的接地材料是否满足光伏电站全寿命的使用要求，并给当地光伏接地设计提供数据支撑，确保光伏电站在寿命期中的安全运行，同时能够降低改造成本，解决了现有技术接地材料出现不同程度的腐蚀情况，导致接地系统不能满足光伏电站整个寿命期的安全运行，且由于光伏电站的子阵接地系统面积大，接地材料使用量巨大，接地改造费用过高，光伏电站运行过程中更换接地材料的难度很大的问题。
G16C60/00  ,一种复合材料铺层设计优化方法及系统 [发明],本发明涉及数字数据处理技术领域，提出了一种复合材料铺层设计优化方法及系统，包括：获取铺层的铺放高度；根据铺层的铺放高度获取待处理铺层序列，根据待处理铺层序列获取截断数据点集及局部密度，根据截断数据点集及局部密度获取递减均匀性指数，根据递减均匀性指数获取待处理铺层序列的子序列；根据待处理铺层序列的子序列获取仿真铺层序列，根据仿真铺层序列获取最大承受应力及褶皱角度，根据最大承受应力及褶皱角度获取非线性目标函数，利用遗传优化算法基于非线性目标函数获取目标铺层序列；根据目标铺层序列的铺层顺序获取铺层设计优化结果。本发明提高了应力在复合材料铺层上传递的均匀性，提高了复合材料的质量。
G16B50/00  ,代谢组学的参考谱图数据库的建立方法、装置及电子设备 [发明],本申请实施例提供了一种代谢组学的参考谱图数据库的建立方法、装置及电子设备、装置、电子设备及计算机可读存储介质，涉及代谢组学领域。该方法包括：确定代谢组学样本中多个未知代谢物的第一质谱数据；从与代谢组学样本相关的文献中，确定代谢组学样本中疑似存在的各个化合物以及各个化合物的参考数据，参考数据为分子结构信息和真实质谱数据中的至少一种；根据各个第一质谱数据和各个化合物的参考数据，确定与各个化合物分别关联的第一质谱数据。本申请实施例相比现有技术不需要购买标准品，并且在实际应用时用于可获得的文献的数量是充沛的，并且参考数据也是比较准确的，最终获得的关联关系的误差相比现有技术的途径二更小。
G01N27/622  ,一种结合无机矩阵中有机物的贡献细分二次有机气溶胶的来源解析方法 [发明],本发明公开了一种结合无机矩阵中有机物的贡献细分二次有机气溶胶的来源解析方法，包括如下步骤，S1、含氮碎片和含硫碎片比值标定；S2、区分有机硝酸酯和无机硝酸盐的最佳温度确定；S3、PMF的浓度矩阵确定；S4、PMF的误差矩阵确定。优点是：基于热扩散管‑气溶胶质谱仪系统观测，利用无机硝酸盐和有机硝酸酯挥发性的差异，从硝酸铵中分离出有机硝酸酯的贡献；利用无机硫酸盐和有机硫化物之间含硫碎片比值差异，从硫酸铵中分离出有机硫化物的贡献，并将这两者与有机矩阵相结合，实现对复杂大气环境中SOA的精准解析，适用于包括外场观测试验和实验室研究在内的多种场景。该方法对复杂环境，尤其是对前体物复杂的实际大气中SOA的定量和实时变化研究具有重要意义。
G16C60/00  ,基于仿真实验模型的材料成分预测方法、装置及存储介质 [发明],本公开涉及一种基于仿真实验模型的材料成分预测方法、装置及存储介质，涉及材料技术领域。基于仿真实验模型的材料成分预测方法，包括获取优化的第一模型和优化的第二模型，所述优化的第一模型用于确定材料成分的性能，所述优化的第二模型用于确定多种材料成分的比例，所述优化的第一模型和所述优化的第二模型为经过仿真实验优化获得的模型；根据所述优化的第一模型和所述优化的第二模型，对真实实验中的材料成分进行预测。该方法能够提高真实实验中材料成分的预测效果，从而加快新材料的研发效率。
G16C20/10  ,一种钢包高效脱硫的方法 [发明],本发明涉及一种钢包高效脱硫的方法，钢包脱硫涉及吹炼终点磷含量、终点温度、终点氧化性、钢包底吹效果的动力学条件(流量、时间)以及钢包与碱度、渣量有关的钢包改质剂加入量等多种复杂因素，并且各种因素之间相互影响、互为制约，通过系统梳理各种条件、总结分析各种影响因素、建立模型结合历史数据进行分析、预判，系统考虑、均衡兼顾，探讨各种参数的最佳平衡点，从而实现钢包内条件下的低成本精准高效脱硫。
G11B7/241  ,含POSS纳米材料的光致聚合物全息存储材料、制备方法及应用 [发明],本发明公开了一种含POSS纳米材料的光致聚合物全息存储材料、制备方法及应用，按照质量份数计包括以下组分：25～50份的成膜剂，5～25份的单体丙烯酰胺，1～10份的亚甲基双丙烯酰胺，0.1～1份的多面体齐聚倍半硅氧烷POSS，0.01～0.1份的光敏剂，1～10份的单体丙烯酸，0.1～2份的三乙醇胺。通过在聚乙烯醇/丙烯酰胺体系中掺杂POSS纳米材料并进行配比，显著改善了材料的体积收缩率，同时保持了原材料体系的高衍射效率、高感光灵敏度、高空间分辨率等性能指标，在全息显示、全息存储、干涉计量等领域有良好的应用价值。
E04D13/064  ,一种超长复合式屋面天沟施工工法 [发明],本发明提供了一种超长复合式屋面天沟施工工法，属于建筑施工技术领域，该超长复合式屋面天沟施工工法为根据天沟材料的温度线膨胀系数，计算所述天沟安装位置最高温度与最低温度下天沟伸缩的最大值，得出天沟最大变形状态下的长度；计算得出当日天沟下料长度将天沟骨架进行焊接，将所述天沟与屋面板采用钢质堵头加氯丁橡胶密封条的方式密封固定并进行闭水试验；按照计算变形后的天沟伸缩设计值，加工天沟伸缩缝盖板，并将其与天沟焊接固定，完成超长复合式屋面天沟的施工；能够解决定现有的屋面天沟的刚性伸缩缝受长度限制，无法保证排水的连续性，施工工艺复杂、后期渗漏检修困难且不易采用虹吸排水的方式，达不到最佳的防水效果的问题。
G16C20/30  ,基于第一性原理预测元素对金属间化合物生长影响的方法 [发明],本发明公开了基于第一性原理预测元素对金属间化合物生长影响的方法，包括以下步骤：建立金属间化合物及其掺杂模型；金属间化合物及其掺杂结构优化；确定稳定掺杂模型：计算Ni＆lt;subgt;3＆lt;/subgt;Sn＆lt;subgt;4＆lt;/subgt;中原子的空位形成能；CI‑NEB寻找Ni＆lt;subgt;3＆lt;/subgt;Sn＆lt;subgt;4＆lt;/subgt;原子扩散路径的过渡态；确定Ni＆lt;subgt;3＆lt;/subgt;Sn＆lt;subgt;4＆lt;/subgt;的主要扩散路径；稳定掺杂模型主要扩散路径的扩散激活能；掺杂前后主要扩散通道能量变化。本发明中采用第一性原理，从原子尺度，电荷分布，结构稳定性等方面进行研究，可以对焊料与基板之间的界面IMC生长过程中原子迁移行为进行微观解释，并经过渡态搜索来确定金属间化合物的主要扩散路径。在对晶体结构进行原子迁移的能量计算时，通过比较掺杂前后的能量变化，从而达到预测金属间化合物生长快慢的目的。
