IPC主分类,发明名称,摘要
G06F30/28  ,基于宾汉浆液自重与角度的柱形渗透注浆范围确定方法 [发明],本发明涉及环境保护与生态修复技术领域，尤其是基于宾汉浆液自重与角度的柱形渗透注浆范围确定方法。本发明所提供的渗透注浆范围确定方法，包括如下步骤：获取待注浆的多孔介质的第一数据；获取注浆点的第二数据；获取待注入多孔介质的宾汉水泥浆液的第三数据；设置注浆工程参数；构建柱形渗透注浆范围确定模型；利用柱形渗透注浆范围确定模型结合第一数据、第二数据以及第三数据，获得多孔介质在基于注浆工程参数的注浆工程下的柱形渗透注浆空间扩散范围量化指标。本发明综合考虑了宾汉浆液自重与注浆管铺设角度对多孔介质渗透注浆空间扩散形态的影响，利用所述渗透注浆范围确定方法能够精准确定宾汉浆液在多孔介质中的柱形渗透注浆扩散范围。
B01D53/34  ,一种高纯次磷酸钠制备方法及设备 [发明],本申请涉及次磷酸钠制备领域，提出了一种高纯次磷酸钠制备方法及设备，包括：将泥磷、水、碱分别加入到反应釜中制取次磷酸钠粗产品溶液，将初始反应产生的尾气经过缓冲瓶收集，经吸附柱水浴加热进行吸附，然后用过量的溴化硝酸吸收液对解吸后的尾气进行吸收，根据尾气处理过程中水浴温度以及磷酸根离子浓度的变化调控溴化硝酸吸收液浓度；将次磷酸钠粗产品溶液、氢氧化钙、硫酸亚铁置于反应器中振荡反应，加入絮凝剂后蒸馏浓缩，随后进行重结晶分离得到次磷酸钠溶液；将对次磷酸钠溶液进行重结晶及过滤分离制取高纯次磷酸钠。本申请通过调控溴化硝酸吸收液浓度，提高了溴化硝酸吸收液的尾气处理效果。
G06F30/28  ,基于宾汉浆液自重与角度的柱半球渗透注浆范围确定方法 [发明],本发明涉及环境保护与生态修复技术领域，尤其是基于宾汉浆液自重与角度的柱半球渗透注浆范围确定方法。本发明所提供的渗透注浆范围确定方法包括如下步骤：获取待注浆的多孔介质的第一数据；获取注浆点的第二数据；获取待注入多孔介质的宾汉水泥浆液的第三数据；设置注浆工程参数；构建柱半球形渗透注浆范围确定模型；利用柱半球形渗透注浆范围确定模型结合第一数据、第二数据以及第三数据，获得多孔介质在基于注浆工程参数的注浆工程下的柱半球形渗透注浆空间扩散范围量化指标。本发明综合考虑了宾汉浆液自重与注浆管铺设角度对多孔介质的柱半球形渗透注浆空间扩散形态的影响，能够精准确定宾汉浆液在多孔介质中的柱半球形渗透注浆扩散范围。
G01N21/39  ,一种基于多传感器数据融合的甲烷气体泄漏检测方法 [发明],本发明公开了一种基于多传感器数据融合的甲烷气体泄漏检测方法，将激光甲烷检测传感器数据、可见光视频监控数据、红外测温传感器数据、红外视频监控数据等不同维度、不同模式、不同表达形式的各种信息进行集中融合处理与分析，降低了信息的模糊度，增强了系统的可靠性和稳定性。
A23L33/105  ,一种解酒组合物的制备方法 [发明],本发明涉及饮用组合物制备技术领域，尤其涉及一种解酒组合物的制备方法，包括，步骤S1，原料预处理；步骤S2，颗粒粉碎处理；步骤S3，冲泡测试；步骤S4，曲线判定；步骤S5，曲线合并；步骤S6，包装。本发明通过对解酒组合物中的若干种主料成分进行多级粉碎与筛分，以制得不同粒径配比不同的原料颗粒，实现在冲泡解酒组合物的后期也能有较高的萃取率，不但由于粒径较小的原料颗粒更容易渗透，使快速达到萃取率高的主料冲泡，且随着时间的增长，基于粒径逐级递增分布，使有效成分的释放减缓程度分级，根据冲泡测试的测试结果，适应性调控等级数、粒径以及不同粒径的配比，以实现对有效成分的控释，且增加释放的持续性与稳定性。
G06N10/20  ,量子系统的基态获取方法、装置、存储介质和电子设备 [发明],本申请实施例提供了一种量子系统的基态获取方法、装置、存储介质和电子设备，其中，该方法包括：在通过量子控制模块执行变分量子线路求解量子系统基态的过程中，通过测量模块测量哈密顿量在参考量子态下的能量参数；在能量参数不满足收敛条件的情况下，通过测量模块测量量子系统在参考量子态下的目标态信息，其中，目标态信息是参考量子态所具有的能够表达量子系统的基态性质的信息；根据目标态信息更新量子控制模块所使用的参考初始态，直至检测出能量参数满足收敛条件，得到量子控制模块输出的输出态；根据输出态获取量子系统的基态。通过本申请，解决了量子计算系统获取基态的效率较低的问题，达到了提高量子计算系统获取基态的效率的效果。
G06F30/23  ,一种塔型井架承载力测定方法、系统及设备 [发明],本发明公开了一种塔型井架承载力测定方法、系统及设备，涉及海洋平台结构与装备安全评定技术领域，包括：获取塔型井架主体参数；根据主体参数建立结构性能数据库和几何截面参数数据库，构建初始有限元模型；利用振动传感器优化布置原理构建振动测试模型；通过初始有限元模型分析塔型井架危险位置并布置应变传感器，构建应变测试模型；匹配初始有限元模型和振动测试模型获得模态参数，利用模态参数对有限元模型修正，构建多尺度模型，匹配多尺度模型与应变测试模型获得实测应变值，利用实测应变值对有限元多尺度模型修正，构建数字孪生模型；对数字孪生模型进行塔型井架承载能力仿真试验，测定承载能力。本发明能够准确测得海洋塔型井架承载力。
G16C20/20  ,一种应用特征碎片及特征碎片组辅助非靶向筛查的方法 [发明],本发明公开一种应用特征碎片及特征碎片组辅助非靶向筛查的方法，涉及有机污染物筛查技术领域，该方法包括：获取样品包含的化合物的初步鉴定结果；初步鉴定结果是应用气相色谱高分辨质谱对样品进行扫描，将解卷积之后的峰与NIST谱库匹配以后得到的；从初步鉴定结果中选择满足预设匹配条件且含有特征碎片或特征碎片组的化合物，得到多个初始化合物；特征碎片和特征碎片组是联合使用化学信息数据库和NIST谱库从目标大类化合物提取的；从多个初始化合物中选取综合得分最高的初始化合物作为样品的筛查结果。本发明能够提高非靶向筛查结果的准确度。
G16C60/00  ,基于相关性分析的育种数据预测方法 [发明],本发明涉及植物育种技术领域，具体涉及基于相关性分析的育种数据预测方法。方法包括：获取材料清单集合和剩余材料清单集合；对材料清单集合中的每个材料清单进行育种筛选，得到目标材料清单集合；若目标材料清单集合中的每个材料清单对应的育种性状特征值均不符合预设的目标育种性状特征值要求，则根据目标材料清单集合中的各个材料清单对应的育种性状特征值之间的相关性，在剩余材料清单集合中获取第一材料清单集合；并继续对第一材料清单集合中的每个第一材料清单进行育种并筛选，直至第一目标材料清单集合中的任一第一材料清单对应的育种性状特征值符合预设的目标育种性状特征值要求时停止。本发明能够提高育种实验的效率。
G06F18/27  ,一种基于GA-LSTM高光谱定量反演的布料成分分析方法及系统 [发明],本发明公开了一种基于GA‑LSTM高光谱定量反演的布料成分分析方法及系统，涉及检测技术领域，包括：接收样本布料光谱数据，对样本布料光谱数据进行预处理，得到样本数据，将样本数据进行分类得到训练集和测试集；将训练集和测试集输入至预先建立的长短期记忆神经网络LSTM的布料成分分析回归模型内，输出得到一次训练LSTM的布料成分分析回归模型；优化一次训练LSTM的布料成分分析回归模型的学习率，将优化后的学习率输入至一次训练LSTM的布料成分分析回归模型内，输出得到二次训练LSTM的布料成分分析回归模型；将待测布料的融合后的光谱数据输入至二次训练LSTM的布料成分分析回归模型内，得到布料成分分析结果。
G16C20/20  ,一种基于化学需氧量的压裂返排液影响因素主次分析方法 [发明],本发明涉及一种基于化学需氧量的压裂返排液影响因素主次分析方法，属于油田压裂液返排处理技术领域。步骤如下：（1）获取在不同施工条件及地面处理条件下得到的压裂返排液；（2）对获取到的不同影响因素下产生的压裂返排液进行化学需氧量分析，记录不同对比组化学需氧量数值；（3）确定压裂返排液化学成分影响因素的分析序列；（4）数据预处理；（5）计算分析子序列中的影响因素与分析母序列中评价指标的关联程度；（6）通过关联程度对压裂返排液化学成分的影响因素进行主次关系排序。本发明基于对油田现场压裂返排液化学需氧量的测试数据，分析了油田现场压裂返排液化学成分影响因素的主次关系排序。
G06F30/20  ,车用功率模块随机振动分析方法、装置和计算机设备 [发明],本申请涉及一种车用功率模块随机振动分析方法、装置和计算机设备。所述方法包括：构建车用功率模块的初始模型，对所述初始模型进行结构简化和干涉检查，得到中间模型；对所述中间模型进行材料选型、工程特性数据校核、电气简化和布尔运算，得到处理完成的模型；对处理完成的模型进行模态分析，得到目标模态阶数；利用所述目标模态阶数对处理完成的模型进行随机振动仿真，基于仿真结果对所述车用功率模块进行随机振动分析。采用本方法能够提高随机振动分析准确性。
G06F30/28  ,微污染河流人工湿地治理系统设计方法及系统 [发明],本发明公开了微污染河流人工湿地治理系统设计方法及系统，应用于计算机辅助设计技术，方法包括：获取第一参数和第二参数；计算去除率；通过预处理沉淀模型获取第一设计参数和第三参数；通过人工湿地模型获取第二设计参数和第四参数；通过氧化塘模型获取氧化塘的第三设计参数；根据第一设计参数、第二设计参数和第三设计参数设计人工湿地治理系统。本发明微污染河流人工湿地治理系统设计方法及系统，提供了一种可以进行微污染河流人工湿地治理系统的设计参数进行自动生成的技术方案，可以有效的降低新建治理系统时的设计成本，并且对不同的河流区域具有很强的适用性，有利于大规模推广，降低各地区河流微污染带来的影响。
G01N17/00  ,混凝土结构氯盐侵蚀耐久性评定方法、系统及装置 [发明],本发明提供了一种混凝土结构氯盐侵蚀耐久性评定方法、系统及装置，涉及混凝土结构耐久性评估技术领域，方法主要包括：制备标准试件；对标准试件进行氯盐侵蚀加速试验；搭建光谱系统；扫描标准试件，得到光谱数据；检测标准试件中目标离子的化学指标；基于化学指标与光谱数据之间的对应关系，构建数据库；筛选数据库中目标离子的特征波长；基于特征波长及化学指标，训练神经网络模型，用于推算氯离子含量；采集被测构件的光谱数据，输入神经网络模型，输出氯离子含量。本发明不会破坏被测构件或结构的整体性，评定速度快、准确性高且功能扩展性强，通过采集光谱扫描数据，即可对混凝土结构氯盐侵蚀耐久性做出准确评估。
G06F30/23  ,基于有限元和分子动力学的SERS基底仿真优化方法 [发明],本发明属于有限元仿真优化技术领域，具体涉及基于有限元和分子动力学的SERS基底仿真优化方法，步骤包括通过有限元仿真软件构建包括上部介质区域和下部SERS基底区域的整体物理模型；通过模型开发器的接口和模块设置相关参数；在模型开发器中划分网格，进行求解计算和后处理得到电场增强因子；构建分子动力学模型和吸附模型并求解得到吸附信息；进行相关性分析获得参数优化模型。本发明充分考虑了实际SERS基底结构的有限元物理模型构建与电磁分析，并且充分考虑了罗丹明6G分子构型和基底结构，进而建立了分子吸附的分子动力学模型，能够较为准确的解析SERS基底的拉曼增强机制，并为基底结构优化提供了量化数据。
G06F30/20  ,电池的容量衰减仿真方法、装置、计算机设备和存储介质 [发明],本申请涉及一种电池的容量衰减仿真方法、装置、计算机设备和存储介质，该方法包括：获取锂离子电池的仿真工况数据；将仿真工况数据输入至预设的容量衰减仿真模型中，通过容量衰减仿真模型根据仿真工况数据模拟锂离子电池在循环充放电过程的析锂反应面积变化情况，获得锂离子电池的容量衰减曲线；容量衰减仿真模型是基于锂离子电池在不同析锂程度下的析锂反应面积构建的。采用本方法能够准确模拟锂离子电池由于析锂而产生的容量衰减。
G06F30/20  ,一种氮气驱气补能的氮气注入量确定方法 [发明],本发明属于气田开发领域，特别涉及一种氮气驱气补能的氮气注入量确定方法；在本发明中，将气藏地下容积利用开采前后的不同情况对比建立了氮气驱气补能的气藏物理模型，通过分别定义每个部分的计算方法并将其组合得到了氮气驱气补能的气藏数学模型，对该数学模型进行迭代计算，根据氮气注入量与其对应计算得到的压力绘制氮气注入量与地层压力的关系图，根据氮气驱气补能需要补充的地层能量，即将地层压力恢复到某个具体的压力值，代入氮气注入量与地层压力的关系图中，确定氮气的注入量。该方法在气藏提采的实际应用中具有理论上的合理性和实际生产应用价值。
G16C20/10  ,一种千瓦级固体氧化物燃料电池电堆的均质化建模方法 [发明],本发明公开一种千瓦级固体氧化物燃料电池电堆的均质化建模方法，包括步骤：建立固体氧化物燃料电池电堆三维几何模型；对电堆进行均质化处理，获取均质化电堆几何模型，并等效处理电池单元各部分结构的材料参数；基于均质化电堆几何模型，模拟分析电堆内流体流动情况，分析电堆的进气不均匀度，并根据进气不均匀度对电堆的各层电池单元进行分组；建立不同进气条件下的单电池单元多场耦合模型，输出相应的电化学反应质量源和热源；基于均质化电堆几何模型，设置边界条件，并输入质量源和热源，建立电堆多物理场耦合数值模型。本发明通过将电堆进行均质化等效处理得到均质化数值模型，用于电堆数值模拟时计算精度高、计算效率高。
G06F30/27  ,一种基于深度学习的低周疲劳寿命预测方法 [发明],本发明公开了一种基于深度学习的低周疲劳寿命预测方法，属于寿命预测技术领域，包括以下步骤：S1、获取金属材料的应力应变数据，并根据应力应变数据生成滞回曲线图像；S2、构建ConTrans模型；S3、将滞回曲线图像输入至ConTrans模型中，确定金属材料的寿命。本发明与现有的机器学习算法相比，能够高保真地利用滞回曲线图像的全局以及局部信息，实现端到端的映射函数，提高疲劳寿命预测的精度和通用性。
G16C60/00  ,孔隙随机分布的C/C复合材料的强度预测方法及装置 [发明],本申请公开了一种孔隙随机分布的C/C复合材料的强度预测方法及装置，该方法包括：获取C/C复合材料试件的各相的体积参数与静态参数；基于静态参数构建C/C复合材料试件的有限元分析模型；根据体积参数与有限元分析模型构建精细化分析模型；其中，精细化分析模型包括多个孔隙率不同的有限元分析模型；对精细化分析模型进行静力学分析得到承载能力曲线，并获得C/C复合材料试件在拉伸载荷作用下的失效过程；根据承载能力曲线与失效过程预测C/C复合材料试件的承载能力。解决了现有技术中有限元建模分析方法无法准确评估C/C复合材料的强度问题，能够有效评估C/C复合材料的强度，并能够降低试验成本。
G16C60/00  ,软模-复合材料网格结构相互作用分析方法及装置 [发明],本发明涉及复合材料技术领域，特别涉及一种软模‑复合材料网格结构相互作用分析方法及装置。方法包括：基于目标软膜参数和目标复合材料参数，确定采用所述目标软膜生成所述目标复合材料时所需的理论工艺间隙；基于所述理论工艺间隙和目标软膜参数，确定等效材料参数；所述等效材料参数包括材料厚度、模量和热膨胀系数；基于所述目标软膜、所述等效材料和所述目标复合材料，建立有限元模型；利用所述有限元模型分析在利用所述目标软膜生成所述目标复合材料网格结构时两者之间的相互作用；其中，有限元分析过程中所述等效材料的参数随其应变的改变而改变。本申请，可以将固化过程中的几何不连续问题转化为材料的非线性问题，提高计算效率。
G06F30/17  ,基于软膜成型的复合材料网格结构筋条截面形状分析方法 [发明],本发明涉及复合材料技术领域，特别涉及一种基于软膜成型的复合材料网格结构筋条截面形状分析方法。方法包括：基于预先构建的软膜‑复合材料有限元模型，计算在正应力作用下，复合材料网格结构筋条的初始截面形状；正应力为利用软膜生成复合材料网格结构时，软膜与复合材料网格结构之间的垂直挤压力；预先确定利用软膜生成复合材料网格结构时，软膜和复合材料网格结构之间的剪切层；将剪切层施加在复合材料网格结构筋条的初始截面上，得到挤压‑剪切作用耦合分析模型；对挤压‑剪切作用耦合分析模型进行求解，得到复合材料网格结构筋条的最终截面形状。本申请，收敛性好，可以准确计算复合材料筋条的截面尺寸。
G16C60/00  ,基于光纤光栅的软膜-复合材料相互作用分析方法及装置 [发明],本发明涉及复合材料技术领域，特别涉及一种基于光纤光栅的软膜‑复合材料相互作用分析方法及装置。方法包括：基于多根光纤光栅的测量数据，分别确定目标复合材料脱粘时，不同厚度处目标软膜与目标复合材料界面间的最大剪应力和最小剪应力；每根光纤光栅分别平行地埋置于目标软膜的不同厚度处，以测量目标软膜在相应厚度处的正应变；将每个最大剪应力和最小剪应力进行组合，得到脱粘时目标软膜和目标复合材料界面间的剪应力场；将剪应力场作为预先构建的有限元模型的输入，以利用有限元模型计算目标软膜与目标复合材料之间的相互作用。本申请，可以准确确定脱粘阶段软膜与复合材料界面间的剪应力场，提高软膜与复合材料之间相互作用的计算精度。
G16C60/00  ,复合材料网格结构的固化变形预报及优化方法 [发明],本发明涉及复合材料结构成型技术领域，特别涉及一种复合材料网格结构的固化变形预报及优化方法。方法包括：获取利用仿真模型建立的与固化变形相关的敏感参数数据库；其中，敏感参数数据库的每一条数据样本至少含有网格节点铺层阶差的敏感工艺参数、筋条宽度的敏感工艺参数和网格结构固化变形圆度的敏感工艺参数；利用敏感参数数据库对预先构建的神经网络进行训练，得到预报模型；以利用预报模型实现对复合材料网格结构的固化变形的高效率预报。另外，基于预报模型和粒子群优化算法，可以实现对铺层阶差、筋条宽度和固化变形圆度的敏感工艺参数的高精度快速优化。
G16C60/00  ,考虑温度场和筋条变形的网格结构固化变形预测方法 [发明],本发明涉及复合材料技术领域，特别涉及一种考虑温度场和筋条变形的网格结构固化变形预测方法。该方法通过将热压罐非均匀性温度场和筋条截面变形结果考虑到固化变形的因素中，这充分考虑了网格结构构件在固化过程中热压罐非均匀性温度场和筋条截面变形的影响，从而可以精确预测网格结构构件的固化变形。
G16C60/00  ,复合材料网格结构数字化建模方法和建模装置 [发明],发明涉及复合材料仿真技术领域，特别涉及一种复合材料网格结构数字化建模方法和建模装置。应用于有限元仿真软件，方法包括：利用数字单元嵌入方式，对复合材料的网格节点和模具进行有限元建模，并对建模得到的网格节点模型进行节点压实模拟，得到目标节点模型；对目标节点模型进行区域划分，并计算每一个区域的纤维体积分数；对复合材料的网格结构进行建模，以利用区域划分结果对建模得到的初始网格结构模型进行拆分，并对拆分得到的每个区域赋予对应的纤维体积分数，得到复合材料的目标网格结构模型。本方案通过为复合材料网格结构各个区域赋予不同的纤维体积分数，来提高复合材料网格结构的模拟精度。
G06F30/17  ,网格结构构件的固化变形预测方法及装置 [发明],本发明涉及复合材料技术领域，特别涉及一种网格结构构件的固化变形预测方法及装置。该方法通过在固化变形预测模型中融入了树脂流动‑压实模型和硅胶软模边界条件模型，这充分考虑了网格结构构件在节点处的树脂含量和体积的变化以及硅胶软模作用下预浸料的粘弹性力学行为，从而可以精确预测网格结构构件的固化变形。
G06F30/23  ,复合材料网格结构的铺层阶差预报方法和装置 [发明],本发明涉及复合材料工艺力学技术领域，特别涉及一种复合材料网格结构的铺层阶差预报方法和装置。应用于有限元仿真软件，方法包括：利用数字单元嵌入方式，对复合材料的网格节点和模具进行有限元建模，得到网格节点模型和模具模型；将网格节点模型放入模具模型后施加载荷，以模拟节点压实过程；在节点压实过程模拟完成后，得到网格节点的铺层阶差。本方案可以对网格节点模型和模具模型进行精细化建模，然后模拟节点压实过程，以此来实现对节点铺层阶差的精准预报。
G01N21/63  ,基于钠光源和智能算法的多指标煤质分析仪及检测方法 [发明],本发明涉及煤质分析领域，具体公开了基于钠光源和智能算法的多指标煤质分析仪及检测方法。多指标煤质分析仪包括钠光源、探测器、智能分析芯片和触控屏。其中，触控屏用于显示多个候选指标、初始样本集、初筛煤质分析模型集。智能分析芯片用于利用对应的实际训练样本集对第一数量个煤质分析模型进行训练，得到第一数量个实际煤质分析模型；利用第一数量个实际煤质分析模型分别对特征谱进行分析，得到第一数量个煤质分析结果；根据第一数量个煤质分析结果生成煤质分析报告。由此，避免了给操作人员带来安全风险，以及使得煤质分析结果以及最终生成的煤质分析报告更加准确。
G06Q50/02  ,基于三元猪饲料原料有效能预测定安黑猪和定安猪饲料原料有效能的方法 [发明],本发明公开了一种基于三元猪饲料原料有效能预测定安黑猪和定安猪饲料原料有效能的方法，包括以下步骤：S1.三元猪、定安黑猪和定安猪饲料原料有效能及营养物质消化率的测定与比较；S2.基于三元猪饲料原料有效能的定安黑猪和定安猪有效能预测模型的建立。本申请针对性地评价玉米、豆粕两种常规饲料原料以及海南省地源性饲料原料在定安黑猪和定安猪上有效能，有助于实现定安黑猪和定安猪精准营养，避免饲料浪费造成的养殖成本的增加；基于三元猪有效能建立了定安猪和定黑猪有效能预测方程，有助于实现三元猪饲料原料数据库向定安猪、定安黑猪原料数据库转移，为定安黑猪和定安猪的精准营养与高效饲养奠定了良好的基础。
